rating,dateS,title,review,dateP,author,aLocation,ownerR,ListingId
3,"2011-02-04T21:26:29.365Z",Aut harum quibusdam amet molestias.,Voluptatibus aut repellendus illo voluptatem qui consectetur sint. Qui tempora in ipsa et est ad tempora. Natus ab pariatur.,"2011-02-04T21:26:29.365Z",Kaia Grady,"Genesisside, CT",Nobis maxime eum. Unde temporibus sit. Dolorem unde quis iste vero ipsum. Autem non aut dolor quia alias fugit dolor et. Enim dolores quos impedit quos ut amet temporibus laudantium. Perspiciatis illum magnam voluptatem nemo sunt magni labore.,0
1,"2019-08-01T16:57:55.764Z",Dolores dicta et fuga enim autem accusamus veritatis deserunt.,Aliquid iusto temporibus ad. Beatae ad eum. Rerum qui non consectetur laborum est voluptate rem. Corrupti ipsa natus voluptatum recusandae.,"2019-08-01T16:57:55.764Z",Rene Strosin,"North Collin, VT",Laborum dicta sunt reprehenderit sed atque et necessitatibus ex adipisci. Dolorem occaecati voluptatibus. Dolores voluptas eos molestias voluptas sit laborum sit. Quibusdam non adipisci. Qui necessitatibus accusamus doloribus.,0
2,"2013-12-28T03:56:49.643Z",Aut ad quidem similique aut suscipit illum in.,Maxime aliquid dolore impedit neque qui voluptates corrupti. Vel est et vel ipsa ut aperiam vel porro id. Dolore adipisci cupiditate quia temporibus et necessitatibus qui impedit ut. Et laboriosam quis dolor id. Sint occaecati nostrum minus quo dolore repudiandae quidem ut eos.,"2014-01-28T03:56:49.643Z",Isabell Konopelski,"Wilhelmineborough, CT",Non corrupti voluptatem esse aut in sit sit totam. Quae beatae iure dicta quibusdam ea ea quis sunt autem. Dolorum blanditiis quo ut. Et consequatur laboriosam nisi ipsam sint ipsa voluptates. Aperiam ab eum ut.,0
4,"2009-03-04T23:19:37.180Z",Hic veniam qui est.,Distinctio est praesentium ut sit natus minus animi architecto et. Deserunt provident fugiat quibusdam aliquam maiores maiores velit sapiente. Est vitae repellat iure nostrum dolore veritatis non ullam. Officiis quidem et qui similique pariatur aut ratione officiis. Necessitatibus repudiandae maiores quis suscipit et delectus commodi voluptas sequi. Iusto deleniti accusantium reprehenderit.,"2009-03-04T23:19:37.180Z",Taylor Flatley,"Cedrickmouth, MT",Quis cupiditate ab quis doloribus nihil et quia. Iste cum voluptas dolorum. Est animi corporis sed quis sapiente voluptatibus sint. Vel reprehenderit eaque optio nam qui ad quam. Fugit reiciendis repudiandae alias occaecati qui ducimus minus iusto.,0
3,"2011-07-27T12:57:38.645Z",Rerum ut sunt sequi dolorem.,Earum voluptatibus quis praesentium sit veritatis quo voluptatem iusto non. Alias officiis ut consectetur doloribus hic exercitationem harum enim iure. Quae autem beatae ratione voluptatibus temporibus. Dolores maiores sint deleniti. Repellendus sit eos ut nihil laboriosam quidem. Architecto delectus animi dolore et quia voluptatem.,"2011-07-27T12:57:38.645Z",Althea Carroll,"North Lela, ID",Voluptates deserunt temporibus voluptas occaecati rerum neque. Nemo illo quia quos commodi voluptas accusamus et qui. Debitis voluptas dolore et corrupti voluptatem. Eaque assumenda ex iste dolores qui eaque est. Reprehenderit provident tempore. Optio eos qui similique est consequatur quia enim.,0
3,"2019-01-11T07:13:06.851Z",Numquam consectetur facilis fugiat similique reprehenderit placeat corrupti.,Quaerat aperiam sint et nostrum rerum qui est accusamus quod. Pariatur consequatur quas dicta ut. Deleniti ipsam consequuntur maxime ab distinctio fuga aut. Et ipsa nulla officiis. Sed inventore maxime non cupiditate aut fuga nemo a. Molestiae cupiditate ducimus et modi nihil illum nihil facere.,"2019-02-11T07:13:06.851Z",Jaylan Runolfsdottir,"Greenholtberg, WA",Voluptatum occaecati nam enim cum ipsum minus. Quia dolorem exercitationem eos. Distinctio provident rerum id nisi nisi quaerat dicta dolore vel. Consequatur tenetur molestiae voluptate nihil voluptas sint. Ratione sit quam vero ut non officia.,0
4,"2008-10-01T11:00:14.170Z",Doloremque eligendi deserunt in blanditiis.,Temporibus deleniti numquam omnis. Voluptatem sed placeat quaerat consequuntur et. In tempore doloribus necessitatibus.,"2008-10-01T11:00:14.170Z",Audreanne Schmitt,"Port Brooklynview, WA",Reiciendis libero modi enim et. Explicabo consequatur a quod est. Amet est omnis consequatur placeat eum modi nihil sapiente est. Quod autem adipisci eos et.,0
4,"2006-01-21T14:16:05.970Z",Nihil illum numquam delectus ut voluptatibus.,Velit officia deleniti dolores aspernatur et dignissimos ut. Occaecati dolores sint est in. Doloremque sit enim.,"2006-01-21T14:16:05.970Z",Bettye Shanahan,"Schadenshire, CT",Ullam consequatur et. Optio nihil eius enim aut. Dolores praesentium adipisci velit assumenda cupiditate ipsum excepturi praesentium placeat.,0
1,"2009-08-31T12:37:23.559Z",Recusandae rerum quam hic quo enim incidunt.,Aut odit magnam est et aliquid. Qui delectus nihil vitae rem hic quidem animi porro. Ea natus tenetur.,"2009-08-31T12:37:23.559Z",Ezra Stroman I,"East Aniyafurt, TX",Et minus sit. Rem aspernatur enim aut excepturi. Officia illo fugit aut molestias. Dolorem id exercitationem minima sed doloribus voluptatibus fuga ex. Ullam nostrum et aut qui quisquam aut aut. Sequi dignissimos dolor velit.,0
1,"2016-09-04T04:42:31.473Z",Delectus libero beatae id officia sunt quia.,Et et quia voluptates. Est non hic est hic omnis optio ab consequatur et. Voluptatem quidem qui suscipit excepturi non repellat corrupti quia ipsa. Maiores explicabo ipsum in fugiat quisquam ea nihil.,"2016-09-04T04:42:31.473Z",Ahmad Quigley,"New Austin, MI",Voluptatem incidunt voluptatem totam est perferendis. Sint maiores vero qui. Ut unde officiis aut qui ea. Qui quibusdam numquam non quia quaerat commodi. Itaque veritatis vitae corrupti fugiat iure.,0
1,"2016-10-10T07:01:36.988Z",Aut nulla libero sed sed unde neque autem velit.,Aut quasi accusantium cupiditate quod qui hic exercitationem et. Est quia harum maiores neque pariatur aliquam amet. A error eaque unde dolor vel cum sed sit error. Molestiae ex aut mollitia nemo tempore inventore eos. Non perferendis reiciendis ut et ab tempora.,"2016-10-10T07:01:36.988Z",Otho Kreiger,"Brockstad, NJ",Sunt provident est modi. Fugiat incidunt tempora autem a et veritatis distinctio. Quisquam reprehenderit maxime illo quae incidunt molestiae et error quas.,0
3,"2005-07-31T20:53:56.543Z",Dolorem hic est iusto sint.,Aspernatur qui quo perferendis qui. Omnis amet omnis neque iusto qui perferendis. Quam rerum voluptatem non assumenda minus. Voluptas ut autem quas velit magnam fuga numquam deserunt occaecati. Fugit debitis voluptas. Ea voluptas eveniet soluta voluptatem minima id quod.,"2005-07-31T20:53:56.543Z",Neil Oberbrunner,"Schowalterland, AR",Facilis dolore rem neque ullam molestiae labore consequatur et. Reprehenderit tempore assumenda magnam reiciendis optio necessitatibus. Impedit facere doloremque nihil exercitationem libero ullam molestiae. Repudiandae est asperiores eum harum eveniet aliquam in repudiandae.,0
2,"2017-03-30T17:59:02.211Z",Praesentium eligendi eius ratione veniam aliquam dolor culpa.,Quis nam non fugiat et dolorem iste. Consequuntur debitis accusantium dignissimos ab ad. Nihil doloremque iure recusandae perspiciatis qui. Quos culpa eveniet tempore consequatur non nulla dicta. Eaque laborum doloremque est quas consequatur laboriosam temporibus.,"2017-04-30T17:59:02.211Z",Miss Kris Langworth,"West Lulaview, TX",A assumenda in. Et eum et sapiente velit saepe esse. Ipsa eius itaque optio.,0
2,"2012-07-25T12:07:48.287Z",Quos aut totam vitae nesciunt quos esse et suscipit.,Aut non asperiores molestiae aut blanditiis. Dolore rerum dolores enim qui itaque voluptate. Nam voluptatem voluptates iure et aspernatur enim rerum non officia.,"2012-08-25T12:07:48.287Z",Carolyn Larson,"Krajcikland, NH",Repudiandae voluptatem cumque consequuntur vitae veritatis deleniti. Nihil laudantium at eos. Facere pariatur ea autem omnis impedit.,0
4,"2014-09-17T03:13:36.087Z",Expedita quo expedita.,Architecto eum quos voluptas assumenda modi deserunt nisi et. Sed fugiat est tenetur quibusdam cum et ut iure et. Ullam quis omnis sunt fugiat exercitationem. Ipsum illo necessitatibus rerum sint dolor. Veniam vero cupiditate ab.,"2014-09-17T03:13:36.087Z",Kayli Brakus V,"South Silasborough, WA",Architecto nihil est repellat magni tenetur unde cupiditate ea. A voluptate exercitationem eum incidunt neque nesciunt facere necessitatibus ex. Inventore cum qui ipsa similique. In veniam sit dolor maiores.,0
